Title,Type,URL,category,sub_categories,Publish date,Publish month,Publish year,Last update,Last update month,Last update year,January,February,March,April,May,June,July,August,September,October,November,December
What is Alteryx? An Introductory Guide,blogs,/blog/what-is-alteryx-introductory-guide,Data Analysis,[],2024-01-09,2024-01,2024,,,,1504.2,4457.4,11109,29670,46395.6,43953,45374.4,45402,43111.2,40420.2,37301.4,28359
How to Send Slack Messages with Python,tutorials,/tutorial/how-to-send-slack-messages-with-python,Python,[],2024-01-12,2024-01,2024,,,,2911.8,9080.4,15663,18354,19402.8,17705.4,17181,18574.8,16008,16849.8,11881.8,10005
How to Make a Seaborn Histogram: A Detailed Guide,tutorials,/tutorial/how-to-make-a-seaborn-histogram,Python,['Data Visualization'],2024-01-11,2024-01,2024,,,,2194.2,9936,17691.6,21321,19168.2,15635.4,15359.4,16822.2,17581.2,18588.6,14531.4,10957.2
An 8-Step Guide to Becoming a Power BI Developer in 2025,blogs,/blog/becoming-a-power-bi-developer,Power BI,[],2024-01-25,2024-01,2024,2024-10-24,October,2024,483,9839.4,19168.2,25392,29697.6,30567,38888.4,33465,23887.8,20230.8,23460,17429.4
What is Retrieval Augmented Generation (RAG)?,blogs,/blog/what-is-retrieval-augmented-generation-rag,Artificial Intelligence,[],2024-01-05,2024-01,2024,2024-01-30,January,2024,6099.6,14158.8,33506.4,44739.6,40185.6,30332.4,28469.4,24288,23308.2,21445.2,20258.4,20382.6
How to Use the SUMX Power BI Functions,tutorials,/tutorial/how-to-use-the-sumx-power-bi-functions,Power BI,[],2024-01-31,2024-01,2024,,,,27.6,4457.4,17843.4,24633,26496,26371.8,30456.6,31422.6,28814.4,31753.8,23694.6,20851.8
Alteryx Tutorial: A Comprehensive Hands-On Guide for Data Analytics,tutorials,/tutorial/alteryx-tutorial-guide-for-data-analytics,Data Analysis,[],2024-01-16,2024-01,2024,,,,841.8,1890.6,2925.6,4802.4,5340.6,4816.2,5809.8,5796,5092.2,4733.4,4084.8,2787.6
PySide6 Tutorial: Building GUI Applications with Python,tutorials,/tutorial/introduction-to-pyside6-for-building-gui-applications-with-python,Python,[],2024-01-31,2024-01,2024,,,,0,2415,5354.4,5451,6265.2,4761,5050.8,5947.8,5823.6,6348,6389.4,4416
Databricks Tutorial: 7 Must-know Concepts For Any Data Specialist,tutorials,/tutorial/introduction-to-databricks,Data Analysis,['Big Data'],2024-01-16,2024-01,2024,,,,441.6,1393.8,6003,10667.4,12475.2,10460.4,11509.2,10350,10377.6,9770.4,7603.8,7948.8
Cross-Entropy Loss Function in Machine Learning: Enhancing Model Accuracy,tutorials,/tutorial/the-cross-entropy-loss-function-in-machine-learning,Machine Learning,['Deep Learning'],2024-01-11,2024-01,2024,2024-08-10,August,2024,2152.8,7051.8,23749.8,75900,93798.6,72643.2,70214.4,64653,77238.6,79363.8,68903.4,56069.4
Q4 2023 DataCamp Donates Digest,blogs,/blog/q4-2023-datacamp-donates-digest,DataCamp Donates,['Learner Stories'],2024-01-27,2024-01,2024,,,,124.2,82.8,124.2,0,41.4,55.2,55.2,27.6,0,41.4,0,0
Navigating R Certifications in 2024: A Comprehensive Guide,blogs,/blog/r-certification-guide,R,['Career Services'],2024-01-19,2024-01,2024,2024-04-18,April,2024,138,1200.6,2359.8,2842.8,3629.4,2842.8,2746.2,3532.8,2967,3298.2,2801.4,1876.8
How to Comment Out a Block of Code in Python,tutorials,/tutorial/python-block-comment,Python,[],2024-01-31,2024-01,2024,2024-07-19,July,2024,55.2,62707.2,107019,121412.4,130465.2,104673,97083,107419.2,118597.2,144817.2,85849.8,56580
A Guide to Python Hashmaps,tutorials,/tutorial/guide-to-python-hashmaps,Python,['Data Engineering'],2024-01-23,2024-01,2024,2024-12-03,December,2024,358.8,2304.6,14752.2,25723.2,33520.2,37881,39192,38446.8,34362,41041.2,24122.4,21528
dbt Tutorial: 7 Must-Know Concepts For Data Engineers,tutorials,/tutorial/dbt-tutorial-must-know-concepts-for-data-engineers,Data Engineering,[],2024-01-11,2024-01,2024,,,,979.8,1794,5464.8,8652.6,11799,8735.4,8942.4,8114.4,8031.6,7493.4,6527.4,5630.4
Anaconda vs Python: Exploring Their Differences,blogs,/blog/anaconda-vs-python-key-differences,Python,['Python'],2024-01-09,2024-01,2024,2024-12-10,December,2024,1904.4,2525.4,7231.2,10612.2,13896.6,15345.6,14007,13786.2,11164.2,11357.4,7686.6,7327.8
MongoDB Tutorial: How to Set Up and Query MongoDB Databases,tutorials,/tutorial/mongodb-tutorial-how-to-set-up-and-query-mongodb-databases,Python,['Data Engineering'],2024-01-11,2024-01,2024,2024-09-20,September,2024,441.6,441.6,552,1462.8,1131.6,1242,579.6,938.4,427.8,441.6,579.6,414
A Beginner's Guide to Python for Loops: Mastering for i in range,tutorials,/tutorial/python-for-i-in-range,Python,[],2024-01-31,2024-01,2024,,,,41.4,1987.2,1297.2,1987.2,2194.2,1600.8,2208,2042.4,3629.4,3670.8,2815.2,1504.2
Top 45 AWS Interview Questions and Answers For 2024,blogs,/blog/top-aws-interview-questions-and-answers,AWS,['Career Services'],2024-02-07,2024-02,2024,2024-10-27,October,2024,0,0,30084,88596,120060,109751.4,115795.8,108716.4,88044,72187.8,81847.8,60112.8
Test-Driven Development in Python: A Beginner's Guide,tutorials,/tutorial/test-driven-development-in-python,Python,[],2024-02-21,2024-02,2024,,,,0,193.2,2787.6,4333.2,5533.8,5644.2,6168.6,5354.4,5520,6072,5423.4,4416
"Tableau Certifications Guide: Certification Levels, Costs & How to Pass",blogs,/blog/tableau-certification,Tableau,['Career Services'],2024-02-04,2024-02,2024,2024-08-30,August,2024,0,1587,4043.4,7479.6,8707.8,7866,8045.4,8694,7341.6,8059.2,5644.2,6058.2
A Beginner's Guide to CI/CD for Machine Learning,tutorials,/tutorial/ci-cd-for-machine-learning,Machine Learning,['Python'],2024-02-16,2024-02,2024,,,,0,1766.4,4167.6,8597.4,7728,7686.6,8376.6,7521,7866,7645.2,6210,5106
Fine-Tuning LLMs: A Guide With Examples,tutorials,/tutorial/fine-tuning-large-language-models,Artificial Intelligence,['Large Language Models'],2024-02-14,2024-02,2024,2024-12-04,December,2024,0,12323.4,85063.2,120253.2,144099.6,111918,114664.2,101568,96958.8,108412.8,92487.6,106467
How DataCamp Helps Drax Accelerate the Transition to Renewable Energy,blogs,/blog/how-datacamp-helps-drax-accelerate-the-transition-to-renewable-energy,Learner Stories,[],2024-02-02,2024-02,2024,,,,0,193.2,41.4,41.4,69,13.8,41.4,55.2,41.4,27.6,27.6,110.4
What is DeepMind AlphaGeometry?,blogs,/blog/what-is-deepmind-alphageometry,Artificial Intelligence,[],2024-02-29,2024-02,2024,,,,0,0,1628.4,1476.6,800.4,400.2,607.2,386.4,165.6,358.8,234.6,289.8
Mastering SQL ROUND: Precision Handling in Data Analysis,tutorials,/tutorial/mastering-sql-round,SQL,['Data Analysis'],2024-02-08,2024-02,2024,,,,0,731.4,5464.8,15290.4,21486.6,15538.8,17388,20824.2,19389,18423,13068.6,9301.2
Stability AI Announces Stable Diffusion 3: All We Know So Far,blogs,/blog/stability-ai-announces-stable-diffusion-3-all-we-know-so-far,Artificial Intelligence,[],2024-02-22,2024-02,2024,,,,0,5175,14490,5050.8,3229.2,3946.8,1518,1104,814.2,220.8,289.8,165.6
How to Use the Python 'Not Equal' Operator,tutorials,/tutorial/not-equal-python,Python,[],2024-02-14,2024-02,2024,,,,0,276,924.6,1283.4,3519,2456.4,2953.2,3905.4,5037,4650.6,2911.8,2001
AI in Finance: Revolutionizing the Future of Financial Management,blogs,/blog/ai-in-finance,Artificial Intelligence,[],2024-02-29,2024-02,2024,2024-06-23,June,2024,0,0,7948.8,14379.6,15497.4,14628,16339.2,13910.4,14766,13068.6,11592,7838.4
Mastering the Pandas .explode() Method: A Comprehensive Guide,tutorials,/tutorial/pandas-explode,Python,[],2024-02-14,2024-02,2024,,,,0,2208,11495.4,13496.4,13096.2,10805.4,10543.2,9742.8,9439.2,9811.8,6789.6,4595.4
Everything We Know About GPT-5,blogs,/blog/everything-we-know-about-gpt-5,Artificial Intelligence,[],2024-02-14,2024-02,2024,,,,0,20741.4,56856,32071.2,17512.2,14283,9301.2,8473.2,8390.4,4788.6,2829,6748.2
A Guide to PyTorch Certifications & Certificates,blogs,/blog/pytorch-certifications-and-certificates,Certification,['Python'],2024-02-14,2024-02,2024,,,,0,841.8,2594.4,3629.4,4126.2,3174,3574.2,3657,2649.6,3091.2,2511.6,2511.6
Mastering Bayesian Optimization in Data Science,tutorials,/tutorial/mastering-bayesian-optimization-in-data-science,Data Analysis,['Machine Learning'],2024-02-02,2024-02,2024,,,,0,1393.8,3312,4443.6,4774.8,4291.8,4222.8,4057.2,3187.8,3146.4,2649.6,1821.6
Semantic Search with Pinecone and OpenAI,tutorials,/tutorial/semantic-search-pinecone-openai,Artificial Intelligence,[],2024-02-28,2024-02,2024,,,,0,69,2829,3988.2,3988.2,3381,3187.8,2580.6,1932,1863,1807.8,1131.6
A Comprehensive Guide to Python Empty Lists,tutorials,/tutorial/python-empty-list,Python,[],2024-02-02,2024-02,2024,,,,0,13800,24646.8,25819.8,20658.6,16311.6,17181,18298.8,22135.2,22894.2,13813.8,8335.2
SQL CONTAINS: A Comprehensive Tutorial,tutorials,/tutorial/sql-contains,SQL,[],2024-02-09,2024-02,2024,,,,0,1104,10432.8,24674.4,36238.8,39564.6,53695.8,60568.2,58249.8,65039.4,34624.2,27641.4
Top 5 SQL Server Certifications: A Complete Guide,blogs,/blog/top-sql-server-certifications,SQL,['Career Services'],2024-02-23,2024-02,2024,2024-10-29,October,2024,0,124.2,4857.6,24922.8,34168.8,28662.6,32995.8,27089.4,22535.4,20244.6,16974,21114
Finding the Size of a DataFrame in Python,tutorials,/tutorial/python-dataframe-size,Python,[],2024-02-14,2024-02,2024,,,,0,1186.8,10170.6,15745.8,17208.6,16725.6,18326.4,16863.6,17595,16008,9991.2,8418
Top 32 Snowflake Interview Questions & Answers For 2024,blogs,/blog/top-snowflake-interview-questions-for-all-levels,Data Engineering,[],2024-02-23,2024-02,2024,2024-10-27,October,2024,0,1380,35535,58553.4,70614.6,61672.2,76424.4,64280.4,58374,53281.8,56704.2,53613
How to Learn Machine Learning in 2024,blogs,/blog/how-to-learn-machine-learning,Machine Learning,['Career Services'],2024-02-22,2024-02,2024,,,,0,496.8,4899,6499.8,6486,7341.6,7176,7783.2,6720.6,6141,5023.2,5050.8
Power BI Certification: A Comprehensive Guide to Choosing The Right Path in 2025,blogs,/blog/power-bi-certification,Power BI,['Career Services'],2024-02-02,2024-02,2024,2024-11-15,November,2024,0,938.4,7396.8,20907,25861.2,24495,24605.4,14283,10888.2,10432.8,6223.8,7714.2
A Deep Dive into the Phi-2 Model,tutorials,/tutorial/phi-2-model,Python,['Artificial Intelligence'],2024-02-02,2024-02,2024,,,,0,12116.4,15718.2,14683.2,9052.8,5257.8,4623,2442.6,2456.4,1587,1255.8,1311
An Introduction to LMQL: The Bridge Between SQL and Large Language Models,tutorials,/tutorial/introduction-to-lmql,Artificial Intelligence,['SQL'],2024-02-08,2024-02,2024,,,,0,1587,1945.8,2967,2801.4,2691,1821.6,1794,1159.2,1255.8,1228.2,1048.8
Building Intelligent Applications with Pinecone Canopy: A Beginner's Guide,tutorials,/tutorial/pinecone-canopy-building-intelligent-applications,Artificial Intelligence,[],2024-02-23,2024-02,2024,,,,0,193.2,1752.6,1131.6,897,455.4,372.6,234.6,303.6,124.2,248.4,82.8
Python Linked Lists: Tutorial With Examples,tutorials,/tutorial/python-linked-lists,Python,[],2024-02-28,2024-02,2024,,,,0,124.2,15718.2,34983,43732.2,37439.4,48576,53378.4,58539.6,59629.8,41248.2,31008.6
Looker vs Tableau: Which is The Best BI Tool For Your Needs?,blogs,/blog/looker-vs-tableau,Tableau,['Business Intelligence'],2024-03-15,2024-03,2024,,,,0,0,386.4,1048.8,1159.2,938.4,1021.2,717.6,979.8,952.2,745.2,469.2
Python Private Methods Explained,tutorials,/tutorial/python-private-methods-explained,Python,[],2024-03-27,2024-03,2024,,,,0,0,276,16725.6,25309.2,21721.2,20893.2,22149,18078,19237.2,14076,10639.8
Fine-Tuning OpenAI's GPT-4: A Step-by-Step Guide,tutorials,/tutorial/fine-tuning-openais-gpt-4-step-by-step-guide,Artificial Intelligence,[],2024-03-14,2024-03,2024,,,,0,0,9784.2,27241.2,35797.2,28869.6,29987.4,32209.2,28483.2,30498,26330.4,21265.8
What is Stable Code 3B?,blogs,/blog/what-is-stable-code-3b,Artificial Intelligence,[],2024-03-01,2024-03,2024,,,,0,0,855.6,524.4,262.2,207,165.6,96.6,207,317.4,207,234.6
PostgreSQL vs. MySQL: Choosing the Right Database for Your Project,blogs,/blog/postgresql-vs-mysql,SQL,['Data Analysis'],2024-03-07,2024-03,2024,2024-09-20,September,2024,0,0,1338.6,3822.6,4043.4,3808.8,6679.2,6748.2,8086.8,10446.6,9066.6,6762
9 Best Open Source Text-to-Speech (TTS) Engines,blogs,/blog/best-open-source-text-to-speech-tts-engines,Artificial Intelligence,['Deep Learning'],2024-03-26,2024-03,2024,2024-12-02,December,2024,0,0,2318.4,36197.4,43677,37784.4,38198.4,32913,23322,26220,18202.2,19623.6
Estimating The Cost of GPT Using The tiktoken Library in Python,tutorials,/tutorial/estimating-cost-of-gpt-using-tiktoken-library-python,Python,['Artificial Intelligence'],2024-03-26,2024-03,2024,,,,0,0,193.2,2428.8,4015.8,3256.8,3118.8,1849.2,1145.4,1628.4,1104,828
A Comprehensive Guide to Working with the Mistral Large Model,tutorials,/tutorial/guide-to-working-with-the-mistral-large-model,Artificial Intelligence,[],2024-03-28,2024-03,2024,,,,0,0,483,16311.6,13192.8,9315,8611.2,4912.8,3808.8,4043.4,2608.2,2718.6
Fine Tuning Google Gemma: Enhancing LLMs with Customized Instructions,tutorials,/tutorial/fine-tuning-google-gemma,Artificial Intelligence,[],2024-03-21,2024-03,2024,,,,0,0,5699.4,15939,8638.8,5809.8,4940.4,3919.2,3836.4,3325.8,2249.4,1242
A Beginner’s Guide to Data Cleaning in Python,tutorials,/tutorial/guide-to-data-cleaning-in-python,Python,[],2024-03-15,2024-03,2024,2024-12-17,December,2024,0,0,1173,6624,9715.2,10557,14655.6,17940,19941,21127.8,17263.8,14655.6
PostgresML Tutorial: Doing Machine Learning With SQL,tutorials,/tutorial/postgresml-tutorial-machine-learning-with-sql,Artificial Intelligence,['SQL'],2024-03-27,2024-03,2024,,,,0,0,289.8,2925.6,4015.8,3643.2,4471.2,3394.8,3891.6,3215.4,2097.6,2980.8
"AWS Cloud Practitioner Salaries Explained: Skills, Demand, and Career Growth",blogs,/blog/aws-cloud-practitioner-salaries,Cloud,[],2024-03-21,2024-03,2024,,,,0,0,317.4,1338.6,2484,2470.2,1959.6,1918.2,1338.6,1062.6,841.8,966
Digital Upskilling Strategies for Transformative Success,blogs,/blog/digital-upskilling-strategies-for-transformative-success,Data Literacy,['Data Science'],2024-03-07,2024-03,2024,,,,0,0,248.4,897,703.8,662.4,676.2,193.2,289.8,372.6,552,124.2
Apache Kafka for Beginners: A Comprehensive Guide,tutorials,/tutorial/apache-kafka-for-beginners-a-comprehensive-guide,Data Engineering,[],2024-03-13,2024-03,2024,,,,0,0,1421.4,5961.6,12834,14407.2,14393.4,19002.6,21100.2,24053.4,20437.8,18643.8
Hugging Face Image Classification: A Comprehensive Guide With Examples,tutorials,/tutorial/hugging-face-image-classification-guide,Artificial Intelligence,[],2024-03-18,2024-03,2024,,,,0,0,510.6,2235.6,2497.8,2139,2263.2,2332.2,1849.2,1587,1573.2,1490.4
Power BI Slicer Tutorial: A Comprehensive Guide to Enhancing Your Reports,tutorials,/tutorial/power-bi-slicer-tutorial,Power BI,[],2024-03-27,2024-03,2024,,,,0,0,82.8,3284.4,8266.2,8956.2,8942.4,9936,9880.8,12185.4,7534.8,6444.6
14 Essential Data Engineering Tools to Use in 2024,blogs,/blog/top-data-engineer-tools,Data Engineering,[],2024-03-08,2024-03,2024,,,,0,0,2691,10363.8,11881.8,11812.8,10777.8,9066.6,9232.2,9094.2,8211,6665.4
Introduction to ChatGPT Next Web (NextChat),tutorials,/tutorial/introduction-to-chatgpt-next-web-nextchat,Artificial Intelligence,[],2024-03-26,2024-03,2024,,,,0,0,110.4,1449,1173,1242,1242,1076.4,1062.6,1117.8,1393.8,1007.4
Hugging Face's Text Generation Inference Toolkit for LLMs - A Game Changer in AI,tutorials,/tutorial/hugging-faces-text-generation-inference-toolkit-for-llms,Artificial Intelligence,[],2024-03-14,2024-03,2024,,,,0,0,3905.4,8073,5437.2,3601.8,3822.6,2994.6,2290.8,2180.4,1656,1614.6
Using Snowflake Time Travel: A Comprehensive Guide,tutorials,/tutorial/using-snowflake-time-travel-a-comprehensive-guide,Data Engineering,[],2024-03-19,2024-03,2024,,,,0,0,400.2,3491.4,8763,8114.4,8611.2,7893.6,7107,6775.8,6113.4,5078.4
The 12 Best AI Coding Assistants in 2024,blogs,/blog/best-ai-coding-assistants,Artificial Intelligence,[],2024-03-01,2024-03,2024,2024-07-17,July,2024,0,0,18726.6,53516.4,26951.4,13220.4,12309.6,15428.4,19678.8,25930.2,31891.8,39302.4
An Introduction to the Mamba LLM Architecture: A New Paradigm in Machine Learning,tutorials,/tutorial/introduction-to-the-mamba-llm-architecture,Machine Learning,['Artificial Intelligence'],2024-03-07,2024-03,2024,,,,0,0,18091.8,34224,28510.8,20658.6,20355,18671.4,14365.8,13455,9604.8,9480.6
Exploring Text-Embedding-3-Large: A Comprehensive Guide to the new OpenAI Embeddings,tutorials,/tutorial/exploring-text-embedding-3-large-new-openai-embeddings,Artificial Intelligence,[],2024-03-15,2024-03,2024,,,,0,0,7065.6,20617.2,25102.2,22038.6,23184,19223.4,18105.6,17677.8,16021.8,15262.8
How to Check if a File Exists in Python,tutorials,/tutorial/how-to-check-if-a-file-exists-in-python,Python,[],2024-04-11,2024-04,2024,,,,0,0,0,579.6,5326.8,12778.8,14821.2,24191.4,22728.6,19402.8,12613.2,9190.8
How to Calculate Confidence Intervals in Excel,tutorials,/tutorial/how-to-calculate-confidence-intervals-in-excel,Spreadsheets,[],2024-04-26,2024-04,2024,,,,0,0,0,1380,27034.2,31643.4,36045.6,32719.8,42849,55186.2,43138.8,25888.8
Introducing DataLab,blogs,/blog/datacamp-is-launching-datalab,DataLab,['Data Analysis'],2024-04-22,2024-04,2024,,,,0,0,0,4002,2401.2,1435.2,1145.4,910.8,1035,938.4,841.8,579.6
What is Llama 3? The Experts' View on The Next Generation of Open Source LLMs,blogs,/blog/meta-announces-llama-3-the-next-generation-of-open-source-llms,Artificial Intelligence,[],2024-04-19,2024-04,2024,,,,0,0,0,5023.2,8142,3408.6,3312,2318.4,2001,1656,1035,1159.2
LOD Expressions in Tableau: A Tutorial With Examples,tutorials,/tutorial/lod-expressions-in-tableau-a-tutorial-with-examples,Tableau,['Data Analysis'],2024-04-05,2024-04,2024,,,,0,0,0,1145.4,5078.4,9080.4,12019.8,16187.4,16146,15759.6,14531.4,11840.4
A Guide to Corporate Data Analytics Training,blogs,/blog/corporate-data-analytics-training,Data Analysis,['Career Services'],2024-04-29,2024-04,2024,,,,0,0,0,13.8,952.2,386.4,207,317.4,496.8,427.8,358.8,427.8
How to Convert a List to a String in Python,tutorials,/tutorial/how-to-convert-a-list-to-a-string-in-python,Python,[],2024-04-12,2024-04,2024,,,,0,0,0,552,6499.8,12930.6,15994.2,26730.6,27779.4,33258,21969.6,13427.4
How to Create a Waterfall Chart in Tableau,tutorials,/tutorial/how-to-create-a-waterfall-chart-in-tableau,Business Intelligence,['Tableau'],2024-04-26,2024-04,2024,,,,0,0,0,165.6,1131.6,1545.6,2525.4,2525.4,2746.2,4871.4,4664.4,3988.2
The Top 20 Deep Learning Interview Questions and Answers,blogs,/blog/the-top-20-deep-learning-interview-questions-and-answers,Deep Learning,[],2024-04-11,2024-04,2024,,,,0,0,0,3988.2,12737.4,14448.6,9646.2,8887.2,6596.4,7217.4,6003,6127.2
Writing Custom Context Managers in Python,tutorials,/tutorial/writing-custom-context-managers-in-python,Python,[],2024-04-12,2024-04,2024,,,,0,0,0,690,4554,5561.4,7010.4,8280,8183.4,10074,6568.8,5147.4
How to Improve RAG Performance: 5 Key Techniques with Examples,tutorials,/tutorial/how-to-improve-rag-performance-5-key-techniques-with-examples,Artificial Intelligence,[],2024-04-12,2024-04,2024,,,,0,0,0,9315,28814.4,31063.8,38019,31712.4,28414.2,24550.2,20451.6,16656.6
Serving an LLM Application as an API Endpoint using FastAPI in Python,tutorials,/tutorial/serving-an-llm-application-as-an-api-endpoint-using-fastapi-in-python,Artificial Intelligence,[],2024-04-12,2024-04,2024,,,,0,0,0,7396.8,14172.6,13317,13565.4,10074,8832,7838.4,7038,7590
An Introduction to Vector Databases For Machine Learning: A Hands-On Guide With Examples,tutorials,/tutorial/introduction-to-vector-databases-for-machine-learning,Machine Learning,[],2024-04-26,2024-04,2024,,,,0,0,0,345,2539.2,2746.2,2511.6,2939.4,2732.4,2553,2898,2304.6
How to Transpose a Matrix in R: A Quick Tutorial,tutorials,/tutorial/how-to-transpose-a-matrix-in-r-a-quick-tutorial,R,[],2024-04-12,2024-04,2024,,,,0,0,0,2373.6,6858.6,9080.4,12489,14876.4,20713.8,17691.6,9604.8,6430.8
Exploring Matplotlib Inline: A Quick Tutorial,tutorials,/tutorial/exploring-matplotlib-inline-a-quick-tutorial,Python,[],2024-04-05,2024-04,2024,,,,0,0,0,841.8,2359.8,3463.8,3974.4,4843.8,5202.6,4995.6,4333.2,3657
A Comprehensive Tutorial on Optical Character Recognition (OCR) in Python With Pytesseract,tutorials,/tutorial/optical-character-recognition-ocr-in-python-with-pytesseract,Python,['Machine Learning'],2024-04-23,2024-04,2024,,,,0,0,0,441.6,15111,13882.8,12502.8,14835,15952.8,15221.4,14186.4,10432.8
How to Convert a String Into an Integer in Python,tutorials,/tutorial/how-to-convert-a-string-into-an-integer-in-python,Python,['Python'],2024-04-05,2024-04,2024,2024-11-24,November,2024,0,0,0,1421.4,16560,35231.4,47292.6,61686,64818.6,54027,20617.2,20010
How to Use the XLOOKUP Excel Function with Multiple Criteria,tutorials,/tutorial/how-to-use-the-xlookup-excel-function-with-multiple-criteria,Spreadsheets,[],2024-04-12,2024-04,2024,,,,0,0,0,2925.6,13758.6,17236.2,24812.4,56800.8,72670.8,91176.6,74257.8,58222.2
Complete Databricks Dolly Tutorial for Building Applications,tutorials,/tutorial/complete-databricks-dolly-tutorial,Data Engineering,[],2024-05-10,2024-05,2024,,,,0,0,0,0,579.6,1076.4,869.4,621,759,786.6,731.4,358.8
Batch Normalization: Theory and TensorFlow Implementation,tutorials,/tutorial/batch-normalization-tensorflow,Artificial Intelligence,['Python'],2024-05-20,2024-05,2024,,,,0,0,0,0,538.2,3629.4,3698.4,5147.4,5837.4,7990.2,8183.4,7645.2
Understanding Prompt Tuning: Enhance Your Language Models with Precision,tutorials,/tutorial/understanding-prompt-tuning,Artificial Intelligence,[],2024-05-19,2024-05,2024,,,,0,0,0,0,5423.4,14986.8,20134.2,16780.8,15607.8,18436.8,15111,12171.6
Databricks DBRX Tutorial: A Step-by-Step Guide,tutorials,/tutorial/databricks-dbrx-tutorial-a-step-by-step-guide,Artificial Intelligence,[],2024-05-09,2024-05,2024,,,,0,0,0,0,2056.2,3753.6,2911.8,2139,1780.2,2152.8,1628.4,924.6
Celebrating the Winning Groups of our DataCamp Donates Challenge,blogs,/blog/celebrating-the-winning-groups-of-our-datacamp-donates-challenge,DataCamp Donates,[],2024-05-09,2024-05,2024,,,,0,0,0,0,110.4,151.8,0,13.8,41.4,27.6,96.6,27.6
What is an IDE? A Guide For Aspiring Data Scientists and Developers,tutorials,/tutorial/what-is-an-ide,Data Analysis,['Data Science'],2024-05-15,2024-05,2024,,,,0,0,0,0,510.6,1090.2,800.4,1587,1007.4,952.2,703.8,731.4
Vertex AI Tutorial: A Comprehensive Guide For Beginners,tutorials,/tutorial/vertex-ai-tutorial,Artificial Intelligence,[],2024-05-17,2024-05,2024,,,,0,0,0,0,3298.2,6886.2,8362.8,10405.2,8155.8,9411.6,8901,6265.2
Snscrape Tutorial: How to Scrape Social Media with Python,tutorials,/tutorial/snscrape-tutorial-web-scraping,Data Science,['Python'],2024-05-07,2024-05,2024,,,,0,0,0,0,4250.4,6099.6,5809.8,8528.4,7935,9853.2,9894.6,8142
Power BI vs Alteryx: Which Should You Use?,blogs,/blog/power-bi-vs-alteryx-a-detailed-comparison,Business Intelligence,['Data Engineering'],2024-05-31,2024-05,2024,,,,0,0,0,0,41.4,2221.8,3836.4,3850.2,3519,3836.4,2428.8,1987.2
What is Few-Shot Learning? Unlocking Insights with Limited Data,blogs,/blog/what-is-few-shot-learning,Machine Learning,[],2024-05-19,2024-05,2024,,,,0,0,0,0,372.6,1117.8,979.8,1283.4,910.8,1766.4,1835.4,1932
Reinforcement Learning: An Introduction With Python Examples,tutorials,/tutorial/reinforcement-learning-python-introduction,Artificial Intelligence,['Machine Learning'],2024-05-02,2024-05,2024,,,,0,0,0,0,3946.8,11150.4,11316,15607.8,17443.2,22687.2,19775.4,16077
How to Use the Stable Diffusion 3 API,tutorials,/tutorial/how-to-use-stable-diffusion-3-api,Artificial Intelligence,[],2024-05-13,2024-05,2024,,,,0,0,0,0,4981.8,7396.8,3422.4,2649.6,2001,2070,1311,1435.2
Normalization in SQL (1NF - 5NF): A Beginner’s Guide,tutorials,/tutorial/normalization-in-sql,SQL,['Data Analysis'],2024-05-28,2024-05,2024,,,,0,0,0,0,151.8,11647.2,21417.6,38709,58429.2,72325.8,55213.8,44229
Power BI Matrix: A Comprehensive Guide,tutorials,/tutorial/power-bi-matrix-a-comprehensive-guide,Power BI,['Business Intelligence'],2024-05-02,2024-05,2024,,,,0,0,0,0,3974.4,8790.6,11122.8,15511.2,17443.2,18243.6,13965.6,11136.6
Snowflake Arctic Tutorial: Getting Started With Snowflake's LLM,tutorials,/tutorial/snowflake-arctic-tutorial,Artificial Intelligence,['Python'],2024-05-27,2024-05,2024,,,,0,0,0,0,648.6,2111.4,2428.8,1186.8,869.4,759,759,883.2
Top 10 Deep Learning Conferences For 2024,blogs,/blog/top-deep-learning-conferences,Deep Learning,['Career Services'],2024-05-21,2024-05,2024,,,,0,0,0,0,552,1435.2,759,1531.8,1435.2,1035,897,455.4
Troubleshooting the No module named 'sklearn' Error Message in Python,tutorials,/tutorial/troubleshooting-the-no-module-named-sklearn-error-message-in-python,Python,['Data Analysis'],2024-05-10,2024-05,2024,,,,0,0,0,0,6541.2,8500.8,11329.8,15414.6,18326.4,20327.4,14614.2,11785.2
How to Use GitHub Copilot: Use Cases and Best Practices,tutorials,/tutorial/github-copilot-a-complete-guide-for-beginners,Python,['Artificial Intelligence'],2024-05-23,2024-05,2024,,,,0,0,0,0,469.2,3657,2898,5920.2,10584.6,8073,6168.6,5092.2
Set Operators in SQL: A Comprehensive Guide,tutorials,/tutorial/set-operators-sql-introduction,SQL,['Data Analysis'],2024-05-23,2024-05,2024,,,,0,0,0,0,1159.2,5368.2,11909.4,16932.6,23349.6,21610.8,18933.6,13013.4
How to Save a Pandas DataFrame to CSV,tutorials,/tutorial/save-as-csv-pandas-dataframe,Data Analysis,['Data Science'],2024-06-26,2024-06,2024,,,,0,0,0,0,0,289.8,10115.4,42379.8,44353.2,43483.8,30015,22397.4
"Top 5 Machine Learning Bootcamps For 2024: Options, Costs, and Alternatives",blogs,/blog/top-machine-learning-bootcamps,Machine Learning,['Career Services'],2024-06-20,2024-06,2024,,,,0,0,0,0,0,400.2,1338.6,4595.4,6237.6,8431.8,7396.8,6182.4
Pandas Reset Index Tutorial,tutorials,/tutorial/pandas-reset-index-tutorial,Python,[],2024-06-27,2024-06,2024,,,,0,0,0,0,0,69,869.4,3836.4,6969,10888.2,9563.4,5561.4
Data Types in Excel and Their Uses: A Complete Guide,tutorials,/tutorial/data-types-in-excel,Excel,['Data Analysis'],2024-06-21,2024-06,2024,,,,0,0,0,0,0,455.4,2042.4,12019.8,16477.2,19458,17898.6,15069.6
