Title,Type,URL,category,sub_categories,Publish date,Publish month,Publish year,Last update,Last update month,Last update year,January,February,March,April,May,June,July,August,September,October,November,December
How to Get the Current Directory in Python,tutorials,/tutorial/python-get-the-current-directory,Python,['Python'],2024-06-24,2024-06,2024,,,,0,0,0,0,0,234.6,6292.8,18768,22080,21390,13896.6,13289.4
How to Use SQL MINUS,tutorials,/tutorial/sql-minus,SQL,['Data Analysis'],2024-06-28,2024-06,2024,,,,0,0,0,0,0,82.8,1766.4,11550.6,18726.6,22977,20631,18726.6
Private Cloud vs. Public Cloud: Which One to Choose?,blogs,/blog/public-private-cloud-difference,Data Engineering,['Big Data'],2024-06-13,2024-06,2024,,,,0,0,0,0,0,151.8,455.4,455.4,979.8,869.4,593.4,607.2
A Comprehensive Guide to K-Fold Cross Validation,tutorials,/tutorial/k-fold-cross-validation,Python,['Data Science'],2024-06-21,2024-06,2024,,,,0,0,0,0,0,1035,3463.8,13317,20217,35328,32236.8,24191.4
What Is One Hot Encoding and How to Implement It in Python,tutorials,/tutorial/one-hot-encoding-python-tutorial,Artificial Intelligence,['Data Science'],2024-06-26,2024-06,2024,,,,0,0,0,0,0,220.8,2566.8,16021.8,23694.6,34638,26703,21417.6
The Complete Guide to Machine Learning on AWS with Amazon SageMaker,tutorials,/tutorial/aws-sagemaker-tutorial,AWS,['Machine Learning'],2024-06-19,2024-06,2024,,,,0,0,0,0,0,786.6,4071,9232.2,11150.4,15235.2,13330.8,12171.6
Python timedelta: Working With Time Intervals in Python,tutorials,/tutorial/timedelta-python-time-intervals,Python,['Data Analysis'],2024-06-02,2024-06,2024,,,,0,0,0,0,0,4264.2,6292.8,14434.8,16394.4,20824.2,15966.6,13455
A Complete Guide to DataWarehousing on AWS with Redshift,tutorials,/tutorial/guide-to-data-warehousing-on-aws-with-redshift,AWS,['Data Engineering'],2024-06-13,2024-06,2024,,,,0,0,0,0,0,386.4,1366.2,2497.8,3519,4319.4,5437.2,4581.6
Mastering SQL Date Comparisons: How to Query for Dates Greater Than a Specific Date,tutorials,/tutorial/sql-date-greater-than,SQL,['Data Analysis'],2024-06-28,2024-06,2024,,,,0,0,0,0,0,1283.4,44712,98863.2,121177.8,143257.8,101278.2,83186.4
"What is Runway Gen-3 Alpha? How it Works, Use Cases, Alternatives & More",blogs,/blog/what-is-runway-gen-3,Artificial Intelligence,[],2024-06-24,2024-06,2024,2024-07-02,July,2024,0,0,0,0,0,8721.6,17719.2,13096.2,10322.4,7714.2,5368.2,3091.2
Top 13 AWS Projects: From Beginner to Pro,blogs,/blog/top-aws-projects,AWS,[],2024-06-19,2024-06,2024,,,,0,0,0,0,0,869.4,5920.2,14835,25198.8,36763.2,34058.4,25433.4
A Comprehensive Guide to Using ANOVA in Excel,tutorials,/tutorial/excel-anova-guide,Excel,['Data Analysis'],2024-06-07,2024-06,2024,,,,0,0,0,0,0,1380,2539.2,7300.2,12364.8,21804,24522.6,20217
Top 30 PySpark Interview Questions and Answers for 2024,blogs,/blog/pyspark-interview-questions,Big Data,['Python'],2024-06-19,2024-06,2024,,,,0,0,0,0,0,12309.6,69579.6,138593.4,144127.2,129099,112332,99567
Top 10 AI Programming Languages: A Beginner's Guide to Getting Started,blogs,/blog/ai-programming-languages,Artificial Intelligence,['Artificial Intelligence'],2024-06-26,2024-06,2024,,,,0,0,0,0,0,96.6,2263.2,6665.4,13510.2,24495,21265.8,19609.8
Kafka vs SQS: Event Streaming Tools In-Depth Comparison,blogs,/blog/kafka-vs-sqs,Data Engineering,['Python'],2024-06-30,2024-06,2024,,,,0,0,0,0,0,0,1863,7548.6,7962.6,9052.8,7562.4,6403.2
ROW_NUMBER SQL Function: How to Display Row Numbers,tutorials,/tutorial/row-number-sql,SQL,['Data Analysis'],2024-06-12,2024-06,2024,,,,0,0,0,0,0,234.6,441.6,2553,6292.8,14628,14158.8,11371.2
Data Structures: A Comprehensive Guide With Python Examples,tutorials,/tutorial/data-structures-guide-python,Data Literacy,['Python'],2024-06-06,2024-06,2024,,,,0,0,0,0,0,1283.4,1421.4,2580.6,3477.6,4954.2,5340.6,4554
PySpark: How to Drop a Column From a DataFrame,tutorials,/tutorial/pyspark-drop-column,Big Data,['Python'],2024-06-16,2024-06,2024,,,,0,0,0,0,0,4002,11812.8,18009,17153.4,20203.2,13744.8,11661
How to Split Lists in Python: Basic Examples and Advanced Methods,tutorials,/tutorial/python-split-list,Python,['Data Analysis'],2024-06-21,2024-06,2024,,,,0,0,0,0,0,5520,27255,59257.2,73885.2,90141.6,60775.2,43635.6
How to Fix the Non-Numeric Argument to Binary Operator Error in R,tutorials,/tutorial/error-fix-non-numeric-argument-to-binary-operator-in-r,R,['Data Analysis'],2024-06-07,2024-06,2024,,,,0,0,0,0,0,2842.8,4968,13482.6,21541.8,26979,18257.4,11081.4
What Is a Data Mesh?,blogs,/blog/data-mesh,Data Science,['Data Literacy'],2024-06-30,2024-06,2024,,,,0,0,0,0,0,0,441.6,897,690,841.8,841.8,731.4
How to Convert Bytes to String in Python,tutorials,/tutorial/bytes-to-string-python,Python,['Python'],2024-06-12,2024-06,2024,,,,0,0,0,0,0,1987.2,5589,10833,12696,14200.2,10267.2,6982.8
What is Master Data Management? Everything Data Professionals Need to Know,blogs,/blog/what-is-master-data-management-everything-you-need-to-know,Data Analysis,['Career Services'],2024-06-07,2024-06,2024,,,,0,0,0,0,0,1421.4,3491.4,6872.4,5533.8,5009.4,3519,2387.4
Integrity Constraints in SQL: A Guide With Examples,tutorials,/tutorial/integrity-constraints-sql,SQL,['Data Science'],2024-06-19,2024-06,2024,,,,0,0,0,0,0,400.2,2028.6,5409.6,10501.8,11771.4,10322.4,5340.6
How to Create Data Models in Excel: A Comprehensive Guide,tutorials,/tutorial/excel-data-model,Excel,['Data Analysis'],2024-07-05,2024-07,2024,,,,0,0,0,0,0,0,1821.6,5589,7921.2,10888.2,9149.4,7286.4
PyTorch Lightning: A Comprehensive Hands-On Tutorial,tutorials,/tutorial/pytorch-lightning-tutorial,Deep Learning,['Python'],2024-07-14,2024-07,2024,,,,0,0,0,0,0,0,1835.4,4954.2,5644.2,6665.4,5133.6,3036
Reskilling and Upskilling in the Age of AI: Challenges and Opportunities For Organizations,blogs,/blog/reskilling-and-upskilling-in-the-age-of-ai,Data Literacy,['For Business'],2024-07-25,2024-07,2024,,,,0,0,0,0,0,0,248.4,648.6,1421.4,2235.6,1752.6,1407.6
"What Is GPT-4o Mini? How It Works, Use Cases, API & More",blogs,/blog/gpt-4o-mini,Artificial Intelligence,['Artificial Intelligence'],2024-07-21,2024-07,2024,,,,0,0,0,0,0,0,2870.4,10515.6,13096.2,11550.6,7548.6,5437.2
How to Write Memory-Efficient Classes in Python,tutorials,/tutorial/write-memory-efficient-classes-in-python,Data Science,['Python'],2024-07-04,2024-07,2024,,,,0,0,0,0,0,0,469.2,2566.8,3105,3036,2097.6,1959.6
How to Best Use the SQL LIMIT Clause,tutorials,/tutorial/sql-limit,SQL,['Data Analysis'],2024-07-05,2024-07,2024,,,,0,0,0,0,0,0,966,7134.6,12530.4,18768,18892.2,15331.8
How to Use the Python pop() Method,tutorials,/tutorial/python-pop,Python,['Data Analysis'],2024-07-31,2024-07,2024,,,,0,0,0,0,0,0,55.2,2953.2,6706.8,12558,11371.2,10764
A Comprehensive Guide to Using Azure Spot Instances for Cost Reduction,blogs,/blog/azure-spot-instances,Data Engineering,"['Big Data', 'Cloud']",2024-07-12,2024-07,2024,,,,0,0,0,0,0,0,179.4,800.4,1228.2,1393.8,1062.6,855.6
UNION vs UNION ALL in SQL,tutorials,/tutorial/sql-union-union-all,SQL,['Data Analysis'],2024-07-19,2024-07,2024,,,,0,0,0,0,0,0,179.4,3781.2,13110,28193.4,19913.4,19278.6
SQL SUM() Function Explained,tutorials,/tutorial/sql-sum,SQL,['Data Analysis'],2024-07-25,2024-07,2024,2024-08-15,August,2024,0,0,0,0,0,0,124.2,317.4,607.2,1380,2111.4,3367.2
What Is Adversarial Machine Learning? Types of Attacks & Defenses,blogs,/blog/adversarial-machine-learning,Artificial Intelligence,['Artificial Intelligence'],2024-07-24,2024-07,2024,,,,0,0,0,0,0,0,124.2,593.4,1435.2,3670.8,3146.4,3146.4
Getting Started with Azure Monitor: Key Features and Best Practices,tutorials,/tutorial/getting-started-with-azure-monitor,Data Engineering,[],2024-07-02,2024-07,2024,,,,0,0,0,0,0,0,372.6,1311,910.8,1076.4,869.4,414
Top 5 Airflow Alternatives for Data Orchestration (Code Examples Included),blogs,/blog/airflow-alternatives,Data Engineering,['Data Science'],2024-07-14,2024-07,2024,,,,0,0,0,0,0,0,8390.4,9604.8,11592,15042,11205.6,11674.8
"What Is PostgreSQL? How It Works, Use Cases, and Resources",blogs,/blog/what-is-postgresql-introduction,Data Science,['Data Engineering'],2024-07-03,2024-07,2024,,,,0,0,0,0,0,0,262.2,1200.6,3477.6,3795,4029.6,3022.2
Building User Interfaces For AI Applications with Gradio in Python,tutorials,/tutorial/gradio-python-tutorial,Artificial Intelligence,['Python'],2024-07-15,2024-07,2024,,,,0,0,0,0,0,0,1435.2,4705.8,5478.6,6872.4,6900,6003
How to Use the SQL EXISTS() Operator,tutorials,/tutorial/sql-exists,SQL,['Data Analysis'],2024-07-08,2024-07,2024,,,,0,0,0,0,0,0,345,2097.6,5354.4,9190.8,9701.4,8086.8
How to Use SQL PIVOT,tutorials,/tutorial/sql-pivot,SQL,['Data Analysis'],2024-07-26,2024-07,2024,,,,0,0,0,0,0,0,469.2,6555,22576.8,62583,61009.8,57904.8
Conditional Formatting in Excel: A Beginner’s Guide,tutorials,/tutorial/conditional-formatting-in-excel,Spreadsheets,['Data Analysis'],2024-07-08,2024-07,2024,,,,0,0,0,0,0,0,386.4,1780.2,3243,7134.6,6361.8,6886.2
How to Use the Python pass Statement,tutorials,/tutorial/python-pass,Python,['Data Analysis'],2024-07-11,2024-07,2024,,,,0,0,0,0,0,0,469.2,2373.6,3118.8,5230.2,3808.8,2649.6
What is a Frequency Histogram? A Comprehensive Guide For Beginners,blogs,/blog/frequency-histograms,Data Analysis,['Data Science'],2024-07-01,2024-07,2024,,,,0,0,0,0,0,0,759,2056.2,6127.2,20079,21362.4,8100.6
How to Use the SQL BETWEEN Operator,tutorials,/tutorial/sql-between,SQL,['Data Analysis'],2024-07-05,2024-07,2024,,,,0,0,0,0,0,0,262.2,1794,4140,7810.8,6568.8,5175
What Is Faiss (Facebook AI Similarity Search)?,blogs,/blog/faiss-facebook-ai-similarity-search,Artificial Intelligence,['Artificial Intelligence'],2024-07-03,2024-07,2024,,,,0,0,0,0,0,0,1669.8,4305.6,4443.6,5699.4,5230.2,5478.6
What is Serverless Computing?,blogs,/blog/serverless-computing,Data Engineering,['Big Data'],2024-07-13,2024-07,2024,,,,0,0,0,0,0,0,331.2,552,1062.6,690,800.4,538.2
Big O Notation and Time Complexity Guide: Intuition and Math,tutorials,/tutorial/big-o-notation-time-complexity,Data Science,['Data Literacy'],2024-07-08,2024-07,2024,,,,0,0,0,0,0,0,621,3905.4,10584.6,13468.8,12737.4,9549.6
Python Boxplots: A Comprehensive Guide for Beginners,tutorials,/tutorial/python-boxplots,Data Visualization,['Python'],2024-07-17,2024-07,2024,,,,0,0,0,0,0,0,1186.8,12489,27144.6,36583.8,30360,22852.8
RAG vs Fine-Tuning: A Comprehensive Tutorial with Practical Examples,tutorials,/tutorial/rag-vs-fine-tuning,Artificial Intelligence,[],2024-07-14,2024-07,2024,,,,0,0,0,0,0,0,2056.2,7355.4,7107,6210,6417,4112.4
Hypothesis Testing Made Easy,tutorials,/tutorial/hypothesis-testing,Data Analysis,['Data Science'],2024-08-15,2024-08,2024,,,,0,0,0,0,0,0,0,483,1021.2,3519,8100.6,8445.6
Understanding the SQL DECODE() Function,tutorials,/tutorial/sql-decode,SQL,['Data Analysis'],2024-08-06,2024-08,2024,,,,0,0,0,0,0,0,0,3643.2,14227.8,27889.8,31905.6,30277.2
"AI in Pharmaceuticals: Benefits, Challenges, and Insights",blogs,/blog/ai-in-pharmaceuticals,Artificial Intelligence,"['AI for Business', 'Cloud']",2024-08-27,2024-08,2024,,,,0,0,0,0,0,0,0,193.2,1738.8,9494.4,14697,8445.6
Data Science in Healthcare: Revolutionizing Patient Care and Operational Efficiency,blogs,/blog/data-science-in-healthcare,Data Science,['For Business'],2024-08-05,2024-08,2024,,,,0,0,0,0,0,0,0,565.8,993.6,1117.8,1435.2,1600.8
"Optimization in Python: Techniques, Packages, and Best Practices",tutorials,/tutorial/optimization-in-python,Python,['Machine Learning'],2024-08-31,2024-08,2024,,,,0,0,0,0,0,0,0,0,5685.6,17346.6,19320,15262.8
Getting Started With Codestral Mamba: Setup & Applications,tutorials,/tutorial/codestral-mamba,Artificial Intelligence,['Artificial Intelligence'],2024-08-06,2024-08,2024,,,,0,0,0,0,0,0,0,786.6,662.4,400.2,427.8,262.2
Python New Line: Methods for Code Formatting,tutorials,/tutorial/python-new-line,Python,['Data Analysis'],2024-08-14,2024-08,2024,,,,0,0,0,0,0,0,0,1131.6,13675.8,55627.8,59767.8,52964.4
"LLM Evaluation: Metrics, Methodologies, Best Practices",blogs,/blog/llm-evaluation,Artificial Intelligence,['Artificial Intelligence'],2024-08-06,2024-08,2024,,,,0,0,0,0,0,0,0,1904.4,6651.6,12916.8,17829.6,15856.2
Python Dictionary Append: How to Add Key-Value Pairs,tutorials,/tutorial/python-dictionary-append,Python,['Data Analysis'],2024-08-06,2024-08,2024,,,,0,0,0,0,0,0,0,6113.4,23708.4,46726.8,39661.2,29752.8
Tableau Count Distinct: Simple Steps to Follow,tutorials,/tutorial/tableau-count-distinct,Tableau,['Data Analysis'],2024-08-14,2024-08,2024,,,,0,0,0,0,0,0,0,234.6,1380,2249.4,2359.8,2277
What is Data Privacy? Why It's Essential for Individuals and Organizations,blogs,/blog/what-is-data-privacy,For Business,"['Data Governance', 'Data Literacy']",2024-08-26,2024-08,2024,,,,0,0,0,0,0,0,0,55.2,772.8,1297.2,2428.8,2304.6
"Apple's DCLM-7B: Setup, Example Usage, Fine-Tuning",tutorials,/tutorial/apple-dclm-7b,Artificial Intelligence,['Large Language Models'],2024-08-12,2024-08,2024,,,,0,0,0,0,0,0,0,538.2,496.8,441.6,234.6,358.8
What Are Data Contracts? A Beginner Guide with Examples,blogs,/blog/data-contracts,Data Engineering,['Data Engineering'],2024-08-26,2024-08,2024,,,,0,0,0,0,0,0,0,110.4,1600.8,4443.6,4540.2,4347
Top 7 AI Video Generators for 2024 With Example Videos,blogs,/blog/top-ai-video-generators,Artificial Intelligence,['Generative AI'],2024-08-11,2024-08,2024,,,,0,0,0,0,0,0,0,20368.8,17457,24467.4,21638.4,14393.4
How to Do a VLOOKUP() with Multiple Criteria,tutorials,/tutorial/vlookup-with-multiple-criteria,Excel,['Data Analysis'],2024-08-07,2024-08,2024,,,,0,0,0,0,0,0,41.4,1614.6,10281,62665.8,99774,116582.4
Grafana Tutorial: A Beginner’s Guide to Monitoring Machine Learning Models,tutorials,/tutorial/grafana-tutorial-monitoring-machine-learning-models,Machine Learning,[],2024-08-01,2024-08,2024,,,,0,0,0,0,0,0,0,1131.6,1725,2967,2911.8,2608.2
Clustered Column Charts in Excel: How to Create and Customize Them,tutorials,/tutorial/clustered-column-chart-in-excel,Data Visualization,['Data Analysis'],2024-08-07,2024-08,2024,,,,0,0,0,0,0,0,0,979.8,6251.4,19223.4,24439.8,19430.4
QR Decomposition in Machine Learning: A Detailed Guide,tutorials,/tutorial/qr-decomposition,Data Science,['R'],2024-08-09,2024-08,2024,,,,0,0,0,0,0,0,0,952.2,2760,5644.2,5768.4,3477.6
XLOOKUP() vs. VLOOKUP(): A Comparison for Excel Users,tutorials,/tutorial/xlookup-vs-vlookup,Excel,['Data Analysis'],2024-08-27,2024-08,2024,,,,0,0,0,0,0,0,0,96.6,993.6,1283.4,3367.2,6016.8
Data Science ROI: How to Calculate and Maximize It,blogs,/blog/data-science-roi,Data Science,['Data Science'],2024-08-25,2024-08,2024,,,,0,0,0,0,0,0,0,179.4,924.6,2028.6,1835.4,979.8
Excel Substring Techniques: Extract and Format Text,tutorials,/tutorial/excel-substring,Excel,['Data Analysis'],2024-08-29,2024-08,2024,,,,0,0,0,0,0,0,0,165.6,703.8,4140,15690.6,37315.2
30 Azure Interview Questions: From Basic to Advanced,blogs,/blog/azure-interview-questions,Azure,"['Data Engineering', 'Cloud']",2024-08-15,2024-08,2024,,,,0,0,0,0,0,0,0,1311,8017.8,41579.4,65867.4,57173.4
"AI in Healthcare: Enhancing Diagnostics, Personalizing Treatment, and Streamlining Operations",blogs,/blog/ai-in-healthcare,Artificial Intelligence,[],2024-08-04,2024-08,2024,,,,0,0,0,0,0,0,0,441.6,469.2,924.6,731.4,869.4
Tiktoken Tutorial: OpenAI's Python Library for Tokenizing Text,tutorials,/tutorial/tiktoken-library-python,Artificial Intelligence,['Artificial Intelligence'],2024-08-07,2024-08,2024,,,,0,0,0,0,0,0,0,3532.8,7148.4,9701.4,10626,8859.6
Python's Walrus Operator: The Assignment Expression (Tutorial),tutorials,/tutorial/python-walrus-operator,Python,['Python'],2024-08-28,2024-08,2024,,,,0,0,0,0,0,0,0,27.6,676.2,1573.2,2208,2346
Azure Storage Accounts: Step-by-Step Tutorial for Beginners,tutorials,/tutorial/azure-storage-accounts,Azure,['Azure'],2024-08-20,2024-08,2024,,,,0,0,0,0,0,0,0,138,1297.2,1449,1117.8,966
"What Is Edge AI? How It Works, Applications, Challenges",blogs,/blog/edge-ai,Artificial Intelligence,['Artificial Intelligence'],2024-08-06,2024-08,2024,,,,0,0,0,0,0,0,0,579.6,1421.4,2056.2,4540.2,7493.4
"AI in Education: Benefits, Challenges, and Ethical Considerations",blogs,/blog/ai-in-education,Artificial Intelligence,['Generative AI'],2024-08-12,2024-08,2024,,,,0,0,0,0,0,0,0,538.2,2760,12254.4,14048.4,9756.6
Python Garbage Collection: Key Concepts and Mechanisms,tutorials,/tutorial/python-garbage-collection,Python,['Data Science'],2024-09-14,2024-09,2024,,,,0,0,0,0,0,0,0,0,662.4,5699.4,8376.6,7603.8
LLM OS Guide: Understanding AI Operating Systems,blogs,/blog/llm-os,Artificial Intelligence,['Large Language Models'],2024-09-25,2024-09,2024,,,,0,0,0,0,0,0,0,0,386.4,3519,7603.8,7465.8
Getting Started with Polars GPU Acceleration: 13x Faster Queries,blogs,/blog/polars-gpu-engine,Python,['Data Science'],2024-09-19,2024-09,2024,,,,0,0,0,0,0,0,0,0,690,2070,1297.2,717.6
Flux AI Image Generator: A Guide With Examples,tutorials,/tutorial/flux-ai,Artificial Intelligence,['Large Language Models'],2024-09-24,2024-09,2024,,,,0,0,0,0,0,0,0,0,3132.6,12999.6,9535.8,8763
"Adagrad Optimizer Explained: How It Works, Implementation, & Comparisons",tutorials,/tutorial/adagrad-optimizer-explained,Deep Learning,['Machine Learning'],2024-09-26,2024-09,2024,,,,0,0,0,0,0,0,0,0,234.6,6306.6,7907.4,7562.4
Mean Shift Clustering: A Comprehensive Guide,tutorials,/tutorial/mean-shift-clustering,Data Science,['Python'],2024-09-12,2024-09,2024,,,,0,0,0,0,0,0,0,0,745.2,3670.8,6748.2,6568.8
CI/CD in Data Engineering: A Guide for Seamless Deployment,blogs,/blog/ci-cd-in-data-engineering,Data Engineering,[],2024-09-15,2024-09,2024,,,,0,0,0,0,0,0,0,0,1090.2,2125.2,2290.8,2511.6
DynamoDB to Redshift: Three Methods for Migrating Data,tutorials,/tutorial/dynamodb-to-redshift,AWS,['Data Engineering'],2024-09-10,2024-09,2024,,,,0,0,0,0,0,0,0,0,483,1518,1035,814.2
Power BI Hierarchies: A Comprehensive Guide,tutorials,/tutorial/power-bi-hierarchies,Power BI,['Data Visualization'],2024-09-02,2024-09,2024,,,,0,0,0,0,0,0,0,0,1656,6196.2,9949.8,11688.6
Power BI Gantt Chart: A Complete How-To,tutorials,/tutorial/power-bi-gantt-chart,Power BI,['Data Analysis'],2024-09-30,2024-09,2024,,,,0,0,0,0,0,0,0,0,124.2,3422.4,8307.6,9204.6
VBA Excel: How to Get Started and Make Your Work Easier,tutorials,/tutorial/vba-excel,Excel,['Data Analysis'],2024-09-07,2024-09,2024,,,,0,0,0,0,0,0,0,0,1973.4,6872.4,20161.8,29421.6
SQL UPDATE with JOIN: How it Works,tutorials,/tutorial/sql-update-with-join,SQL,['Data Engineering'],2024-09-11,2024-09,2024,,,,0,0,0,0,0,0,0,0,938.4,21459,46533.6,52950.6
Top 30 RAG Interview Questions and Answers for 2024,blogs,/blog/rag-interview-questions,Artificial Intelligence,['Large Language Models'],2024-09-18,2024-09,2024,,,,0,0,0,0,0,0,0,0,3312,10557,13013.4,13496.4
Advanced RAG Techniques,blogs,/blog/rag-advanced,Artificial Intelligence,['Large Language Models'],2024-09-30,2024-09,2024,,,,0,0,0,0,0,0,0,0,0,11730,16960.2,18409.2
Azure Data Factory vs Databricks: A Detailed Comparison,blogs,/blog/azure-data-factory-vs-databricks,Azure,['Databricks'],2024-09-11,2024-09,2024,,,,0,0,0,0,0,0,0,0,3036,13192.8,14821.2,13896.6
Introduction to GitHub Codespaces,tutorials,/tutorial/github-codespaces,Git,['Data Engineering'],2024-09-24,2024-09,2024,,,,0,0,0,0,0,0,0,0,317.4,565.8,703.8,676.2
Top 30 Database Administrator Interview Questions for 2024,blogs,/blog/database-administrator-interview-questions,SQL,['Data Engineering'],2024-09-29,2024-09,2024,,,,0,0,0,0,0,0,0,0,41.4,5644.2,16739.4,26192.4
Understanding Euclidean Distance: From Theory to Practice,tutorials,/tutorial/euclidean-distance,Data Science,['Python'],2024-09-13,2024-09,2024,,,,0,0,0,0,0,0,0,0,841.8,7162.2,9094.2,6596.4
A Guide to the DBSCAN Clustering Algorithm,tutorials,/tutorial/dbscan-clustering-algorithm,Machine Learning,"['Python', 'Data Analysis']",2024-09-29,2024-09,2024,,,,0,0,0,0,0,0,0,0,27.6,14738.4,24757.2,19706.4
Git Switch Branch: A Guide With Practical Examples,tutorials,/tutorial/git-switch-branch,Git,['Git'],2024-09-11,2024-09,2024,,,,0,0,0,0,0,0,0,0,648.6,2773.8,3022.2,3077.4
AI in the Workplace: Boosting Efficiency and Upskilling Teams for Business Growth,blogs,/blog/ai-in-the-workplace,Cloud,"['Artificial Intelligence', 'For Business']",2024-09-04,2024-09,2024,,,,0,0,0,0,0,0,0,0,220.8,662.4,1090.2,814.2
What is Transitive Dependency?,tutorials,/tutorial/transitive-dependency,SQL,['Data Engineering'],2024-09-26,2024-09,2024,,,,0,0,0,0,0,0,0,0,303.6,6789.6,7383,5547.6
ARIMA for Time Series Forecasting: A Complete Guide,tutorials,/tutorial/arima,Data Science,['Python'],2024-09-09,2024-09,2024,2024-12-29,December,2024,0,0,0,0,0,0,0,0,10681.2,50728.8,64735.8,54261.6
How to Learn Statistics in 2024: A Complete Guide for Beginners,blogs,/blog/learn-statistics,Data Science,['Data Science'],2024-09-26,2024-09,2024,,,,0,0,0,0,0,0,0,0,220.8,3463.8,7189.8,9259.8
Replit Agent: A Guide With Practical Examples,tutorials,/tutorial/replit-agent-ai-code-editor,Artificial Intelligence,['Large Language Models'],2024-09-10,2024-09,2024,,,,0,0,0,0,0,0,0,0,12199.2,10529.4,7741.8,10419
Top 9 Anaconda Alternatives for Python Environment Management,blogs,/blog/anaconda-alternatives,Python,['Python'],2024-09-04,2024-09,2024,,,,0,0,0,0,0,0,0,0,8183.4,20506.8,17926.2,14614.2
How to Use a SQL Alias to Simplify Your Queries,tutorials,/tutorial/sql-alias,SQL,['Data Analysis'],2024-09-06,2024-09,2024,,,,0,0,0,0,0,0,0,0,731.4,3546.6,4236.6,4043.4
"14 Java Projects For All Levels: Beginner, Intermediate, & Advanced",blogs,/blog/java-projects-for-all-levels,Data Engineering,['Java'],2024-09-22,2024-09,2024,,,,0,0,0,0,0,0,0,0,3353.4,43608,70421.4,67564.8
Corrective RAG (CRAG) Implementation With LangGraph,tutorials,/tutorial/corrective-rag-crag,Artificial Intelligence,['Large Language Models'],2024-09-17,2024-09,2024,,,,0,0,0,0,0,0,0,0,841.8,2911.8,3063.6,3795
"AI in Customer Service: Enhancing Efficiency, Personalization, and Cost Reduction",blogs,/blog/ai-in-customer-service,Cloud,"['Artificial Intelligence', 'For Business']",2024-10-23,2024-10,2024,,,,0,0,0,0,0,0,0,0,0,303.6,1711.2,1987.2
Top 8 Cloud Computing Projects For All Levels,blogs,/blog/cloud-computing-projects,AWS,['Azure'],2024-10-29,2024-10,2024,,,,0,0,0,0,0,0,0,0,0,289.8,3450,6913.8
How to Visualize Machine Learning Models: From Linear Regression to Neural Networks,tutorials,/tutorial/visualize-machine-learning-models,Machine Learning,['Python'],2024-10-23,2024-10,2024,,,,0,0,0,0,0,0,0,0,0,855.6,2635.8,4015.8
"What Is Fraud Analytics? Techniques, Workflows, and Tools",blogs,/blog/fraud-analytics,Data Analysis,['Machine Learning'],2024-10-12,2024-10,2024,,,,0,0,0,0,0,0,0,0,0,979.8,2235.6,3077.4
Llama 3.2 and Gradio Tutorial: Build a Multimodal Web App,tutorials,/tutorial/llama-gradio-app,Artificial Intelligence,['Large Language Models'],2024-10-09,2024-10,2024,,,,0,0,0,0,0,0,0,0,0,6844.8,3905.4,3229.2
10 Docker Project Ideas: From Beginner to Advanced,blogs,/blog/docker-projects,Data Engineering,"['Data Science', 'Docker']",2024-10-08,2024-10,2024,,,,0,0,0,0,0,0,0,0,0,5975.4,14227.8,13344.6
DAX SUMMARIZE(): A Guide to Grouping and Summarizing Data,tutorials,/tutorial/dax-summarize,Power BI,['Data Analysis'],2024-10-11,2024-10,2024,,,,0,0,0,0,0,0,0,0,0,3036,10557,10046.4
OpenAI Realtime API: A Guide With Examples,tutorials,/tutorial/realtime-api-openai,Artificial Intelligence,"['OpenAI', 'Large Language Models']",2024-10-11,2024-10,2024,,,,0,0,0,0,0,0,0,0,0,54303,38598.6,30912
Breadth-First Search in Python: A Guide with Examples,tutorials,/tutorial/breadth-first-search-in-python,Python,['Data Science'],2024-10-30,2024-10,2024,,,,0,0,0,0,0,0,0,0,0,27.6,4830,8901
Databricks vs Snowflake: Similarities & Differences,blogs,/blog/databricks-vs-snowflake,Databricks,"['Snowflake', 'Data Engineering']",2024-10-29,2024-10,2024,,,,0,0,0,0,0,0,0,0,0,110.4,2566.8,3408.6
GPT-4o Vision Fine-Tuning: A Guide With Examples,tutorials,/tutorial/gpt-4o-vision-fine-tuning,Artificial Intelligence,"['OpenAI', 'ChatGPT', 'Large Language Models']",2024-10-09,2024-10,2024,,,,0,0,0,0,0,0,0,0,0,5906.4,3422.4,3077.4
Moving Data with Python and dlt: A Guide for Data Engineers,tutorials,/tutorial/python-dlt,Data Engineering,['Python'],2024-10-01,2024-10,2024,,,,0,0,0,0,0,0,0,0,0,3091.2,2801.4,2980.8
"Meta Movie Gen Guide: How It Works, Examples, Comparison",blogs,/blog/movie-gen-meta,Artificial Intelligence,['Large Language Models'],2024-10-17,2024-10,2024,,,,0,0,0,0,0,0,0,0,0,5865,3753.6,2718.6
Fine-Tuning Phi-3.5 on E-Commerce Classification Dataset,tutorials,/tutorial/fine-tuning-phi-3-5,Large Language Models,['Artificial Intelligence'],2024-10-10,2024-10,2024,,,,0,0,0,0,0,0,0,0,0,3877.8,7576.2,4843.8
Structural Equation Modeling: What It Is and When to Use It,tutorials,/tutorial/structural-equation-modeling,Python,['Data Science'],2024-10-02,2024-10,2024,,,,0,0,0,0,0,0,0,0,0,6458.4,20189.4,21417.6
Minkowski Distance: A Comprehensive Guide,tutorials,/tutorial/minkowski-distance,Data Science,['Python'],2024-10-09,2024-10,2024,,,,0,0,0,0,0,0,0,0,0,3187.8,6141,5533.8
Synthetic Data Generation: A Hands-On Guide in Python,tutorials,/tutorial/synthetic-data-generation,Data Science,['Data Science'],2024-10-21,2024-10,2024,,,,0,0,0,0,0,0,0,0,0,2359.8,12861.6,16132.2
Python Turtle Graphics: A Fun Way to Learn the Basics,tutorials,/tutorial/turtle-graphics,Python,['Data Visualization'],2024-10-03,2024-10,2024,,,,0,0,0,0,0,0,0,0,0,12627,23970.6,25709.4
SQS vs SNS: Understanding AWS Messaging Services,blogs,/blog/sqs-vs-sns,AWS,['Data Engineering'],2024-10-22,2024-10,2024,,,,0,0,0,0,0,0,0,0,0,427.8,2359.8,5727
RMSprop Optimizer Tutorial: Intuition and Implementation in Python,tutorials,/tutorial/rmsprop-optimizer-tutorial,Python,['Machine Learning'],2024-10-23,2024-10,2024,,,,0,0,0,0,0,0,0,0,0,317.4,1214.4,1683.6
